{"sources": [{"role": "discovered_via", "licence": "CC-BY-NC-4.0", "url": "https://developers.events/", "name": "developers.events", "code": "developers-events"}, {"code": "cfp-radar", "name": "cfp-radar", "licence": "CC-BY-4.0", "role": "origin"}],
 "id": "0b6f3a52-2c1e-4c55-9d1f-3f1a8f0e9a10", "slug": "devnexus-2027", "name": "Devnexus 2027", "edition": "2027",
 "summary": {"pt-BR": "Conferência \"Java\" em Atlanta.\nDois dias.", "en": "Java conference in Atlanta — two days.\tTabbed \\ backslash."},
 "machineTranslated": ["summary.pt-BR"], "organizer": {"en": "Atlanta Java Users Group"},
 "dates": {"status": "CONFIRMED", "tba": false, "end": "2027-02-19", "start": "2027-02-18"},
 "location": {"modality": "IN_PERSON", "region": "NA", "countryCode": "US", "city": "Atlanta"},
 "links": {"website": "https://devnexus.com/"}, "topics": ["java", "cloud"], "talkLanguages": ["en"], "eventType": "CONFERENCE",
 "remoteSpeaking": {"basis": "STATED", "value": "NO"},
 "cfp": {"verification": {"by": "official-page-check", "checkedAt": "2026-10-12T06:10:00Z", "status": "official_source_checked"},
         "benefits": {"ticket": "YES", "travel": "PARTIAL"},
         "formats": [{"format": "WORKSHOP", "durationMinutes": 120, "maxSpeakers": 2}, {"format": "TALK", "durationMinutes": 50}],
         "platform": "SESSIONIZE", "url": "https://sessionize.com/devnexus-2027/", "closeTimeKnown": true, "timezone": "America/New_York",
         "closesAt": "2026-11-02T04:59:00Z", "closesOn": "2026-11-01", "opensOn": "2026-09-01"},
 "verification": {"status": "unverified"}, "firstPublishedAt": "2026-10-11T12:00:00Z"}
